{
  "kind": "comparison",
  "slug": "blackbird",
  "status": "published",
  "title": "Blackbird Alternative | MyRecon",
  "description": "Compare Blackbird and MyRecon for blackbird alternative. Review current scope and evidence limits, then try a public username search.",
  "h1": "MyRecon vs Blackbird: compare public-search workflows",
  "focus_keyword": "blackbird alternative",
  "intro": "Looking for a Blackbird alternative depends on the task: Blackbird is described by its official source as an open-source username osint project. MyRecon is a browser route into a public username search. This page compares workflow and fit without inventing a speed score or claiming identical coverage.",
  "sections": [
    {
      "heading": "What Blackbird is designed to do",
      "body": "Blackbird is described by its official source as An open-source username OSINT project. Its published workflow is a local investigator workflow and its current documented platform list. Confirm current access, terms, and available features directly with the provider before relying on a capability for a live investigation."
    },
    {
      "heading": "Where a MyRecon username workflow fits",
      "body": "MyRecon starts from a username and is intended to help review public profile leads across supported checks. Open every candidate source yourself: a handle match is not proof of identity, and unsupported, blocked, or unavailable checks should not be read as a confirmed absence."
    },
    {
      "heading": "Compare evidence rather than headline counts",
      "body": "The tools can use different inputs, data sources, and result rules, so an unmeasured count or speed claim would not be a fair comparison. For Blackbird, check the official documentation linked below; for either workflow, confirm the original source, date, and reason a result is relevant."
    }
  ],
  "sources": [
    "https://github.com/p1ngul1n0/blackbird",
    "https://www.myrecon.xyz/"
  ],
  "reviewed_at": "2026-09-27",
  "modified_at": "2026-09-27",
  "reviewer": "Codex editorial pass",
  "cta": {
    "label": "Search a public username with MyRecon",
    "href": "/"
  },
  "faq": [
    {
      "question": "Is MyRecon a direct replacement for Blackbird?",
      "answer": "Not for every task. Blackbird is documented as an open-source username osint project. MyRecon focuses on a browser-based public username workflow. Choose based on required inputs, access model, source coverage, and the current official documentation."
    },
    {
      "question": "Does MyRecon check more sites than Blackbird?",
      "answer": "No measured, same-scope benchmark is published here, so this page makes no coverage or speed superiority claim. Compare the current source lists, methods, and result definitions under the same authorized test conditions."
    },
    {
      "question": "Can either tool prove two profiles belong to one person?",
      "answer": "A matching username alone cannot establish identity. Open the underlying public profiles and corroborate any proposed connection with independent, voluntarily published context; keep uncertain outcomes clearly labeled."
    }
  ],
  "competitor": {
    "name": "Blackbird",
    "official_url": "https://github.com/p1ngul1n0/blackbird",
    "interface": "CLI"
  },
  "capabilities": [
    {
      "name": "How a search starts",
      "myrecon": "Enter a username in a browser search",
      "competitor": "Use the documented CLI workflow",
      "evidence_url": "https://github.com/p1ngul1n0/blackbird"
    },
    {
      "name": "Primary workflow",
      "myrecon": "Review public username leads from supported checks",
      "competitor": "A local investigator workflow and its current documented platform list.",
      "evidence_url": "https://github.com/p1ngul1n0/blackbird"
    },
    {
      "name": "Evidence review",
      "myrecon": "Open each source and verify a candidate manually",
      "competitor": "Confirm current output and source pages using its official documentation",
      "evidence_url": "https://github.com/p1ngul1n0/blackbird"
    }
  ],
  "benchmark": null,
  "pros": [
    "MyRecon offers a browser-based entry point for a username search",
    "This page makes no unmeasured speed or coverage claim"
  ],
  "cons": [
    "A web username workflow does not replace a specialist tool for every task",
    "Blackbird's current access, coverage, and terms must be checked with its provider"
  ],
  "migration_note": "If you currently use Blackbird, keep it for the tasks and integrations it already serves. To compare a public username workflow, use the same authorized handle in MyRecon, open candidate pages on the original services, and document differences in scope and uncertainty before changing an established process."
}
