{
  "kind": "comparison",
  "slug": "knowem",
  "status": "published",
  "title": "Knowem Alternative | MyRecon",
  "description": "Compare MyRecon with KnowEm for knowem alternative. See workflow, scope, and evidence limits; check current official docs and try a public username search.",
  "h1": "MyRecon vs KnowEm: compare public-search workflows",
  "focus_keyword": "knowem alternative",
  "intro": "Looking for a KnowEm alternative depends on the task: KnowEm is described by its official source as a web service for checking names across social networks and web properties. MyRecon is a browser route into a public username search. This page compares workflow and fit without inventing a speed score or claiming identical coverage.",
  "sections": [
    {
      "heading": "What KnowEm is designed to do",
      "body": "KnowEm is described by its official source as A web service for checking names across social networks and web properties. Its published workflow is brand and username availability checks across its current listed services. Confirm current access, terms, and available features directly with the provider before relying on a capability for a live investigation."
    },
    {
      "heading": "Where a MyRecon username workflow fits",
      "body": "MyRecon starts from a username and is intended to help review public profile leads across supported checks. Open every candidate source yourself: a handle match is not proof of identity, and unsupported, blocked, or unavailable checks should not be read as a confirmed absence."
    },
    {
      "heading": "Compare evidence rather than headline counts",
      "body": "The tools can use different inputs, data sources, and result rules, so an unmeasured count or speed claim would not be a fair comparison. For KnowEm, check the official documentation linked below; for either workflow, confirm the original source, date, and reason a result is relevant."
    }
  ],
  "sources": [
    "https://knowem.com/",
    "https://www.myrecon.xyz/"
  ],
  "reviewed_at": "2026-09-27",
  "modified_at": "2026-09-27",
  "reviewer": "Codex editorial pass",
  "cta": {
    "label": "Search a public username with MyRecon",
    "href": "/"
  },
  "faq": [
    {
      "question": "Is MyRecon a direct replacement for KnowEm?",
      "answer": "Not for every task. KnowEm is documented as a web service for checking names across social networks and web properties. MyRecon focuses on a browser-based public username workflow. Choose based on required inputs, access model, source coverage, and the current official documentation."
    },
    {
      "question": "Does MyRecon check more sites than KnowEm?",
      "answer": "No measured, same-scope benchmark is published here, so this page makes no coverage or speed superiority claim. Compare the current source lists, methods, and result definitions under the same authorized test conditions."
    },
    {
      "question": "Can either tool prove two profiles belong to one person?",
      "answer": "A matching username alone cannot establish identity. Open the underlying public profiles and corroborate any proposed connection with independent, voluntarily published context; keep uncertain outcomes clearly labeled."
    }
  ],
  "competitor": {
    "name": "KnowEm",
    "official_url": "https://knowem.com/",
    "interface": "web"
  },
  "capabilities": [
    {
      "name": "How a search starts",
      "myrecon": "Enter a username in a browser search",
      "competitor": "Use the documented web workflow",
      "evidence_url": "https://knowem.com/"
    },
    {
      "name": "Primary workflow",
      "myrecon": "Review public username leads from supported checks",
      "competitor": "Brand and username availability checks across its current listed services.",
      "evidence_url": "https://knowem.com/"
    },
    {
      "name": "Evidence review",
      "myrecon": "Open each source and verify a candidate manually",
      "competitor": "Confirm current output and source pages using its official documentation",
      "evidence_url": "https://knowem.com/"
    }
  ],
  "benchmark": null,
  "pros": [
    "MyRecon offers a browser-based entry point for a username search",
    "This page makes no unmeasured speed or coverage claim"
  ],
  "cons": [
    "A web username workflow does not replace a specialist tool for every task",
    "KnowEm's current access, coverage, and terms must be checked with its provider"
  ],
  "migration_note": "If you currently use KnowEm, keep it for the tasks and integrations it already serves. To compare a public username workflow, use the same authorized handle in MyRecon, open candidate pages on the original services, and document differences in scope and uncertainty before changing an established process."
}
