{
  "kind": "comparison",
  "slug": "osint-industries",
  "status": "published",
  "title": "MyRecon vs OSINT Industries: OSINT Tools Compared",
  "description": "Compare MyRecon and OSINT Industries: search inputs, public-source workflows and verification limits. Choose an OSINT tool for your authorized research.",
  "h1": "MyRecon vs OSINT Industries: compare public-search workflows",
  "focus_keyword": "osint industries alternative",
  "intro": "Looking for a OSINT Industries alternative depends on the task: OSINT Industries is described by its official source as a web-based osint investigation service. MyRecon is a browser route into a public username search. This page compares workflow and fit without inventing a speed score or claiming identical coverage.",
  "sections": [
    {
      "heading": "What OSINT Industries is designed to do",
      "body": "OSINT Industries is described by its official source as A web-based OSINT investigation service. Its published workflow is its currently documented investigation modules and account workflow. Confirm current access, terms, and available features directly with the provider before relying on a capability for a live investigation."
    },
    {
      "heading": "Where a MyRecon username workflow fits",
      "body": "MyRecon starts from a username and is intended to help review public profile leads across supported checks. Open every candidate source yourself: a handle match is not proof of identity, and unsupported, blocked, or unavailable checks should not be read as a confirmed absence."
    },
    {
      "heading": "Compare evidence rather than headline counts",
      "body": "The tools can use different inputs, data sources, and result rules, so an unmeasured count or speed claim would not be a fair comparison. For OSINT Industries, check the official documentation linked below; for either workflow, confirm the original source, date, and reason a result is relevant."
    }
  ],
  "sources": [
    "https://www.osint.industries/",
    "https://www.myrecon.xyz/"
  ],
  "reviewed_at": "2026-09-27",
  "modified_at": "2026-09-30",
  "reviewer": "Codex editorial pass",
  "cta": {
    "label": "Search a public username with MyRecon",
    "href": "/"
  },
  "faq": [
    {
      "question": "Is MyRecon a direct replacement for OSINT Industries?",
      "answer": "Not for every task. OSINT Industries is documented as a web-based osint investigation service. MyRecon focuses on a browser-based public username workflow. Choose based on required inputs, access model, source coverage, and the current official documentation."
    },
    {
      "question": "Does MyRecon check more sites than OSINT Industries?",
      "answer": "No measured, same-scope benchmark is published here, so this page makes no coverage or speed superiority claim. Compare the current source lists, methods, and result definitions under the same authorized test conditions."
    },
    {
      "question": "Can either tool prove two profiles belong to one person?",
      "answer": "A matching username alone cannot establish identity. Open the underlying public profiles and corroborate any proposed connection with independent, voluntarily published context; keep uncertain outcomes clearly labeled."
    }
  ],
  "competitor": {
    "name": "OSINT Industries",
    "official_url": "https://www.osint.industries/",
    "interface": "web"
  },
  "capabilities": [
    {
      "name": "How a search starts",
      "myrecon": "Enter a username in a browser search",
      "competitor": "Use the documented web workflow",
      "evidence_url": "https://www.osint.industries/"
    },
    {
      "name": "Primary workflow",
      "myrecon": "Review public username leads from supported checks",
      "competitor": "Its currently documented investigation modules and account workflow.",
      "evidence_url": "https://www.osint.industries/"
    },
    {
      "name": "Evidence review",
      "myrecon": "Open each source and verify a candidate manually",
      "competitor": "Confirm current output and source pages using its official documentation",
      "evidence_url": "https://www.osint.industries/"
    }
  ],
  "benchmark": null,
  "pros": [
    "MyRecon offers a browser-based entry point for a username search",
    "This page makes no unmeasured speed or coverage claim"
  ],
  "cons": [
    "A web username workflow does not replace a specialist tool for every task",
    "OSINT Industries's current access, coverage, and terms must be checked with its provider"
  ],
  "migration_note": "If you currently use OSINT Industries, keep it for the tasks and integrations it already serves. To compare a public username workflow, use the same authorized handle in MyRecon, open candidate pages on the original services, and document differences in scope and uncertainty before changing an established process."
}
